{
  "schema": "cherry.training_pack.v1",
  "exportedAt": "2026-09-02T00:00:00Z",
  "recipe": {
    "baseModel": "Qwen/Qwen2.5-1.5B-Instruct",
    "method": "qlora",
    "gpuBudgetGb": 16,
    "maxSeqLen": 1024,
    "loraR": 16
  },
  "examples": [
    {
      "id": "seed-expo-brief",
      "kind": "brief",
      "source": "seed",
      "instruction": "Cherry stüdyosu için mobil uygulama planı yaz. Seçilen yığın ve Clean Architecture. preview/ HTML site yazma. PII uydurma.",
      "input": "Proje: Kahve sipariş\nYığın: EXPO\nBrif:\nMahalle kahvecisi için sipariş listesi. Giriş ve ana ekran. Yerel backend.",
      "output": "Plan (Expo SDK 57, TypeScript):\n- frontend/: domain / data / presentation.\n- backend/: yerel HTTP, barındırma yok.\n- maestro/: login.yaml + home.yaml.\n- preview/ zip’e girmez.",
      "meta": { "stack": "EXPO", "kind": "brief" }
    },
    {
      "id": "seed-expo-entity",
      "kind": "source",
      "source": "seed",
      "instruction": "Bu yola uygun kaynak dosyayı yaz. Seçilen dil. HTML site değil.",
      "input": "Yığın: EXPO\nYol: frontend/src/domain/entities/item.ts\nBrif: Kahve sipariş listesi.",
      "output": "export type Item = {\n  id: string;\n  title: string;\n};\n",
      "meta": { "stack": "EXPO", "path": "frontend/src/domain/entities/item.ts" }
    },
    {
      "id": "seed-flutter-entity",
      "kind": "source",
      "source": "seed",
      "instruction": "Bu yola uygun kaynak dosyayı yaz. Seçilen dil. HTML site değil.",
      "input": "Yığın: FLUTTER\nYol: frontend/lib/features/home/domain/entities/home_item.dart\nBrif: Kahve sipariş listesi.",
      "output": "final class HomeItem {\n  const HomeItem({required this.id, required this.title});\n  final String id;\n  final String title;\n}\n",
      "meta": { "stack": "FLUTTER", "path": "frontend/lib/features/home/domain/entities/home_item.dart" }
    },
    {
      "id": "seed-swift-view",
      "kind": "source",
      "source": "seed",
      "instruction": "Bu yola uygun kaynak dosyayı yaz. Seçilen dil. HTML site değil.",
      "input": "Yığın: NATIVE\nYol: frontend/Presentation/Home/HomeView.swift\nBrif: Kahve sipariş listesi.",
      "output": "import SwiftUI\n\nstruct HomeView: View {\n  var body: some View {\n    Text(\"Siparişler\")\n  }\n}\n",
      "meta": { "stack": "NATIVE", "path": "frontend/Presentation/Home/HomeView.swift" }
    },
    {
      "id": "seed-maestro-login",
      "kind": "maestro",
      "source": "seed",
      "instruction": "Maestro YAML yaz. Cihaz yoksa sonuç SKIPPED olur; PASSED uydurma.",
      "input": "Akış: login.yaml\nSonuç: SKIPPED\nNot: Emülatör yok. PASSED sayılmaz.",
      "output": "appId: com.cherry.demo\n---\n- launchApp\n- assertVisible: \"Giriş\"\n",
      "meta": { "flow": "login.yaml", "result": "SKIPPED" }
    },
    {
      "id": "seed-maestro-home",
      "kind": "maestro",
      "source": "seed",
      "instruction": "Maestro YAML yaz. Cihaz yoksa sonuç SKIPPED olur; PASSED uydurma.",
      "input": "Akış: home.yaml\nSonuç: SKIPPED\nNot: Cihaz yoksa SKIPPED.",
      "output": "appId: com.cherry.demo\n---\n- launchApp\n- assertVisible: \"Siparişler\"\n",
      "meta": { "flow": "home.yaml", "result": "SKIPPED" }
    },
    {
      "id": "seed-completion",
      "kind": "completion",
      "source": "seed",
      "instruction": "GDPR sarmalı tamamla. PII yok. İşçi A, sürüm v1.0.",
      "input": "Brif: [REDACTED_EMAIL] için kahve uygulaması. Kod [REDACTED_CODE].",
      "output": "İşçi A v1.0 plan:\n- Ekranları yığın dosyalarına böl.\n- Maestro akışını giriş + ana ekran tut.\nPII yok.",
      "meta": { "slot": "A", "version": "v1.0" }
    },
    {
      "id": "seed-workers",
      "kind": "brief",
      "source": "seed",
      "instruction": "Cherry stüdyosu için mobil uygulama planı yaz. Seçilen yığın ve Clean Architecture. preview/ HTML site yazma. PII uydurma.",
      "input": "Proje: Kapasite notu\nYığın: EXPO\nBrif:\nA ve B aynı işi yapar. Boş işçi alır; ikisi meşgulse kuyruk. Kod/test ayrımı yok.",
      "output": "Plan:\n- Tek tarif, iki kapasite işçisi.\n- Versiyon pointer’ı sonraki cevabı değiştirir.\n- Colab üretim inferansı değil; checkpoint stüdyoya döner.",
      "meta": { "stack": "EXPO", "kind": "capacity" }
    }
  ],
  "stats": { "liveExamples": 0, "seedExamples": 8 },
  "note": "Seed paket. Canlı iz yokken Colab bununla çalışır. Stüdyoda proje üretince LLM sayfasından canlı paketi indir."
}
